{
  "schema_version": "1.0",
  "tracker_name": "Nova Roma Issue/Update Tracker",
  "scope": "conversation-scoped (not yet persisted into ZIP)",
  "generated_utc": "2026-01-29T00:00:00Z",
  "updates": [
    {
      "update_id": "TEC_V2",
      "title": "Technology Framework & Leveling System",
      "status": "Ready",
      "summary": "Domain-based tech trees; 1–100 Levels; Lvl 90 ≈ 2020; three-letter domain codes; fixed-width; initiatives list one level; domains advance independently.",
      "details": "(a) tech notation format is `XXX-N` and rendered in fixed-width, (b) domains advance independently, (c) level advancement triggers: milestones, research, infrastructure unlocks, systemic breakthroughs.",
      "created_from": "chat",
      "dependencies": [],
      "applies_to": ["MSR", "Tech Tracker", "Initiatives", "Reports"],
      "notes": []
    },
    {
      "update_id": "MSR_V2",
      "title": "Milestone Status Report Format & Rules",
      "status": "Ready",
      "summary": "Required sections + tables; GDP smoothing; news style with in-game effect; advisors include one bad action; no timeline advance unless explicit.",
      "details": "Required sections: News/Events, Completed/Imminent, In Progress, Planned (next 10), Completed Audits, Metrics, Advisors; tables required; Planned/In Progress exclude impact; Completed includes Effect/Impact; Metrics include Δ and Annualized with GDP row second.",
      "created_from": "chat",
      "dependencies": ["TIM_V1"],
      "applies_to": ["MSR"],
      "notes": []
    },
    {
      "update_id": "ZIP_V1",
      "title": "ZIP Availability Detection Rule",
      "status": "Active",
      "summary": "Run ZIP availability test before file-backed operations; sentinel check; downgrade to chat-canon if unavailable; trigger TBD.",
      "details": "Verify zip path exists, open zip and list entries, verify sentinel file(s) (NR_SPEC.json). If fail: set mode to chat-canon only and prefix outputs with CANON_STATUS: ZIP_UNAVAILABLE. No user prompt.",
      "created_from": "chat",
      "dependencies": [],
      "applies_to": ["Any file-backed canon operation"],
      "notes": []
    },
    {
      "update_id": "TIM_V1",
      "title": "Timeline Advance Control",
      "status": "Active",
      "summary": "Only `next` or explicit request advances time; reports/status/MSR cannot advance timeline.",
      "details": "`next` advances 3 days (if that is the campaign rule) and otherwise timeline is frozen unless explicit. If uncertain, write: 'advance interval defined by canon; default 3 days when `next` is used.'",
      "created_from": "chat",
      "dependencies": [],
      "applies_to": ["All commands"],
      "notes": []
    },
    {
      "update_id": "INI_V1",
      "title": "Initiative & Milestone ID Format",
      "status": "Active",
      "summary": "INIT uses `NNNN-X`; milestones `NNNN-X-Y`; fixed-width rendering.",
      "details": "4-letter initiative code + tier number; milestone serial includes tier; all codes must be in fixed-width.",
      "created_from": "chat",
      "dependencies": ["TEC_V2"],
      "applies_to": ["Initiatives", "Milestones", "MSR"],
      "notes": []
    },
    {
      "update_id": "FNT_V1",
      "title": "Fixed-Font Tech Codes",
      "status": "Active",
      "summary": "Tech codes must be monospaced.",
      "details": "Render codes like `ENE-3` in fixed-width in all outputs.",
      "created_from": "chat",
      "dependencies": ["TEC_V2"],
      "applies_to": ["MSR", "Tech Tracker", "Reports"],
      "notes": []
    },
    {
      "update_id": "GDP_V1",
      "title": "GDP Annualization Rule",
      "status": "Active",
      "summary": "Annualized GDP must smooth short-term spikes.",
      "details": "Do not extrapolate raw short-window deltas; use smoothed trend; show Δ using symbol 'Δ'.",
      "created_from": "chat",
      "dependencies": ["MSR_V2"],
      "applies_to": ["Metrics", "MSR"],
      "notes": []
    }
  ]
}
